{
  "id": "region_011_haunted_manor",
  "index": 11,
  "nameKey": "region.haunted_manor",
  "name": "Haunted Manor",
  "status": "live",
  "unlock": {
    "requires": "region_010_toy_factory",
    "gemSkip": 250
  },
  "theme": {
    "bundle": "region_011",
    "palette": [
      "violet",
      "green glow"
    ],
    "music": null
  },
  "rules": {
    "signatureModule": "mod_ghost_platforms",
    "difficultyOffset": 0.0862,
    "platformWeights": {
      "normal": 1.0,
      "signature": 0.3
    },
    "hazards": []
  },
  "coinFactor": 1.3,
  "levels": [
    "lvl_011_01",
    "lvl_011_02",
    "lvl_011_03",
    "lvl_011_04",
    "lvl_011_05",
    "lvl_011_06",
    "lvl_011_07",
    "lvl_011_08",
    "lvl_011_09",
    "lvl_011_10",
    "lvl_011_11",
    "lvl_011_12",
    "lvl_011_13",
    "lvl_011_14",
    "lvl_011_15"
  ],
  "availableFrom": null
}
