{
  "id": "region_028_samurai_dojo",
  "index": 28,
  "nameKey": "region.samurai_dojo",
  "name": "Samurai Dojo",
  "status": "teaser",
  "unlock": {
    "requires": "region_027_arcade_realm",
    "gemSkip": 533
  },
  "theme": {
    "bundle": "region_028",
    "palette": [
      "ink",
      "cherry"
    ],
    "music": null
  },
  "rules": {
    "signatureModule": "mod_falling_blades",
    "difficultyOffset": 0.2328,
    "platformWeights": {
      "normal": 1.0,
      "signature": 0.3
    },
    "hazards": []
  },
  "coinFactor": 1.81,
  "levels": [
    "lvl_028_01",
    "lvl_028_02",
    "lvl_028_03",
    "lvl_028_04",
    "lvl_028_05",
    "lvl_028_06",
    "lvl_028_07",
    "lvl_028_08",
    "lvl_028_09",
    "lvl_028_10",
    "lvl_028_11",
    "lvl_028_12",
    "lvl_028_13",
    "lvl_028_14",
    "lvl_028_15"
  ],
  "availableFrom": null
}
