{
  "id": "region_021_space_station",
  "index": 21,
  "nameKey": "region.space_station",
  "name": "Space Station",
  "status": "teaser",
  "unlock": {
    "requires": "region_020_dragon_peak",
    "gemSkip": 416
  },
  "theme": {
    "bundle": "region_021",
    "palette": [
      "black",
      "cyan"
    ],
    "music": null
  },
  "rules": {
    "signatureModule": "mod_zero_g_zones",
    "difficultyOffset": 0.1724,
    "platformWeights": {
      "normal": 1.0,
      "signature": 0.3
    },
    "hazards": []
  },
  "coinFactor": 1.6,
  "levels": [
    "lvl_021_01",
    "lvl_021_02",
    "lvl_021_03",
    "lvl_021_04",
    "lvl_021_05",
    "lvl_021_06",
    "lvl_021_07",
    "lvl_021_08",
    "lvl_021_09",
    "lvl_021_10",
    "lvl_021_11",
    "lvl_021_12",
    "lvl_021_13",
    "lvl_021_14",
    "lvl_021_15"
  ],
  "availableFrom": null
}
