{
  "id": "region_017_steampunk_skyport",
  "index": 17,
  "nameKey": "region.steampunk_skyport",
  "name": "Steampunk Skyport",
  "status": "live",
  "unlock": {
    "requires": "region_016_cloud_kingdom",
    "gemSkip": 350
  },
  "theme": {
    "bundle": "region_017",
    "palette": [
      "brass",
      "teal"
    ],
    "music": null
  },
  "rules": {
    "signatureModule": "mod_steam_vents",
    "difficultyOffset": 0.1379,
    "platformWeights": {
      "normal": 1.0,
      "signature": 0.3
    },
    "hazards": []
  },
  "coinFactor": 1.48,
  "levels": [
    "lvl_017_01",
    "lvl_017_02",
    "lvl_017_03",
    "lvl_017_04",
    "lvl_017_05",
    "lvl_017_06",
    "lvl_017_07",
    "lvl_017_08",
    "lvl_017_09",
    "lvl_017_10",
    "lvl_017_11",
    "lvl_017_12",
    "lvl_017_13",
    "lvl_017_14",
    "lvl_017_15"
  ],
  "availableFrom": null
}
