{
  "id": "region_003_sunny_beach",
  "index": 3,
  "nameKey": "region.sunny_beach",
  "name": "Sunny Beach",
  "status": "live",
  "unlock": {
    "requires": "region_002_mushroom_grove",
    "gemSkip": 116
  },
  "theme": {
    "bundle": "region_003",
    "palette": [
      "gold",
      "aqua"
    ],
    "music": null
  },
  "rules": {
    "signatureModule": "mod_drifting_platforms",
    "difficultyOffset": 0.0172,
    "platformWeights": {
      "normal": 1.0,
      "signature": 0.3
    },
    "hazards": []
  },
  "coinFactor": 1.06,
  "levels": [
    "lvl_003_01",
    "lvl_003_02",
    "lvl_003_03",
    "lvl_003_04",
    "lvl_003_05",
    "lvl_003_06",
    "lvl_003_07",
    "lvl_003_08",
    "lvl_003_09",
    "lvl_003_10",
    "lvl_003_11",
    "lvl_003_12",
    "lvl_003_13",
    "lvl_003_14",
    "lvl_003_15"
  ],
  "availableFrom": null
}
