{
  "id": "region_027_arcade_realm",
  "index": 27,
  "nameKey": "region.arcade_realm",
  "name": "Arcade Realm",
  "status": "teaser",
  "unlock": {
    "requires": "region_026_storybook_castle",
    "gemSkip": 516
  },
  "theme": {
    "bundle": "region_027",
    "palette": [
      "pixel",
      "neon"
    ],
    "music": null
  },
  "rules": {
    "signatureModule": "mod_pixel_snap",
    "difficultyOffset": 0.2241,
    "platformWeights": {
      "normal": 1.0,
      "signature": 0.3
    },
    "hazards": []
  },
  "coinFactor": 1.78,
  "levels": [
    "lvl_027_01",
    "lvl_027_02",
    "lvl_027_03",
    "lvl_027_04",
    "lvl_027_05",
    "lvl_027_06",
    "lvl_027_07",
    "lvl_027_08",
    "lvl_027_09",
    "lvl_027_10",
    "lvl_027_11",
    "lvl_027_12",
    "lvl_027_13",
    "lvl_027_14",
    "lvl_027_15"
  ],
  "availableFrom": null
}
